[
    {
        "title": "Alpha 4.0 out now!",
        "description": "Check out the new towers, enemies, levels and other improvements, we added in this major release",
        "date": "2025-06-21",
        "image": "/assets/img/FeatureGraphicSmall.png",
        "url": "/news/alpha-4-0.html"
    },
    {
        "title": "Alpha 4.2: Improving the Flow",
        "description": "Quality-of-life improvements, keybinds, soundtrack and more.",
        "date": "2026-02-22",
        "image": "/assets/img/Alpha4_2Banner.png",
        "url": "/news/alpha-4-2-release.html"
    }
]